{
    "$schema": "https://json-schema.org/draft-07/schema",
    "$id": "player-data.schema.json",

    "title": "Player Data",
    "description": "Information on players that provides creature and fleece metadata.",

    "type": "object",
    "properties": {
        "creatures": {
            "type": "object",
            "propertyNames": { "$ref": "#/definitions/CreatureId" },
            "additionalProperties": {
                "type": "object",
                "properties": {
                    "name": {
                        "type": "string",
                        "description": "The display name of this creature."
                    },

                    "variant": {
                        "type": "string",
                        "description": "The variant name of this creature."
                    }
                },

                "required": ["name", "variant"]
            }
        },

        "crowns": {
            "type": "object",
            "propertyNames": { "$ref": "#/definitions/CrownId" },
            "additionalProperties": {
                "type": "object",
                "properties": {
                    "name": {
                        "type": "string",
                        "description": "The display name of this crown."
                    },

                    "variant": {
                        "type": "string",
                        "description": "The variant name of this crown."
                    }
                },

                "required": ["name", "variant"]
            }
        },

        "fleeces": {
            "type": "object",
            "propertyNames": { "$ref": "#/definitions/FleeceId" },
            "additionalProperties": {
                "type": "object",
                "properties": {
                    "name": {
                        "type": "string",
                        "description": "The display name of this fleece."
                    },

                    "category": {
                        "type": "integer",
                        "description": "The category index in the crown menu which this fleece belongs to.",

                        "minimum": 0,
                        "maximum": 2
                    },

                    "variant": {
                        "type": "string",
                        "description": "The variant name of this fleece."
                    }
                },

                "required": ["name", "category", "variant"]
            }
        },

        "bells": {
            "type": "object",
            "propertyNames": { "$ref": "#/definitions/BellId" },
            "additionalProperties": {
                "type": "object",
                "properties": {
                    "name": {
                        "type": "string",
                        "description": "The display name of this bell."
                    },

                    "category": {
                        "type": "integer",
                        "description": "The category index in the crown menu which this bell belongs to.",

                        "minimum": 0,
                        "maximum": 2
                    },

                    "variant": {
                        "type": "string",
                        "description": "The variant name of this bell."
                    }
                },

                "required": ["name", "category", "variant"]
            }
        }
    },

    "required": ["creatures", "crowns", "fleeces", "bells"],
    "definitions": {
        "CreatureId": {
            "type": "string",
            "enum": ["Lamb", "Goat"]
        },

        "CrownId": {
            "type": "string",
            "enum": ["Red", "Purple"]
        },

        "FleeceId": {
            "type": "string",
            "enum": ["Lamb", "Goat", "Golden", "Glass", "Diseased", "Fates", "Fragile", "Cursed", "Berserker", "Fervor", "Hobbled", "Heretic", "Natural", "Silk", "God", "Cowboy", "Rags"]
        },

        "BellId": {
            "type": "string",
            "enum": ["Lamb", "Goat", "Golden", "Glass", "Diseased", "Fates", "Fragile", "Cursed", "Berserker", "Fervor", "Hobbled", "God", "Cowboy"]
        }
    }
}